[
  {
    "id": "personality-001",
    "type": "personality",
    "format": "essay",
    "difficulty": "easy",
    "experienceLevel": "junior",
    "question": "동료 개발자와 의견이 충돌했을 때, 어떻게 해결하시겠습니까?",
    "correctAnswerText": "상대방의 의견을 먼저 경청하고, 자신의 입장을 논리적으로 설명하며 공통점을 찾아 협의합니다. 필요시 제3자의 중재도 고려합니다.",
    "requiredKeywords": ["경청", "공감", "합의"],
    "points": 10,
    "tags": ["협업", "소통"]
  },
  {
    "id": "personality-002",
    "type": "personality",
    "format": "essay",
    "difficulty": "medium",
    "experienceLevel": "junior",
    "question": "팀 프로젝트 중 일정이 지연될 때, 어떻게 팀원들과 소통하며 문제를 해결하시겠습니까?",
    "correctAnswerText": "현재 진행 상황을 명확히 공유하고, 각자의 어려움을 파악한 뒤 현실적인 일정 조정을 제안합니다. 책임 분담을 명확히 하여 팀의 동기부여를 높입니다.",
    "requiredKeywords": ["투명한 소통", "문제 공유", "책임 분담"],
    "points": 15,
    "tags": ["협업", "소통"]
  },
  {
    "id": "personality-003",
    "type": "personality",
    "format": "essay",
    "difficulty": "medium",
    "experienceLevel": "junior",
    "question": "온라인 협업 도구를 통해 팀원과 효과적으로 협업한 경험이 있다면 말씀해주세요.",
    "correctAnswerText": "Slack, Jira 등 협업 도구를 활용해 소통을 원활히 하고, 문서화와 투명한 업무 관리를 통해 프로젝트를 성공적으로 수행한 경험을 공유합니다.",
    "requiredKeywords": ["협업 도구", "투명한 공유", "문서화"],
    "points": 15,
    "tags": ["협업", "소통"]
  },
  {
    "id": "personality-004",
    "type": "personality",
    "format": "essay",
    "difficulty": "easy",
    "experienceLevel": "junior",
    "question": "개발자로서 최근에 어떤 기술을 새로 학습하였으며, 어떻게 활용해 보셨나요?",
    "correctAnswerText": "예: 최근 Java Stream API를 학습하고 개인 프로젝트에 적용하여 코드의 간결성과 효율성을 높였습니다.",
    "requiredKeywords": ["자기계발", "기술 습득", "적용 경험"],
    "points": 10,
    "tags": ["학습", "성장"]
  },
  {
    "id": "personality-005",
    "type": "personality",
    "format": "essay",
    "difficulty": "medium",
    "experienceLevel": "junior",
    "question": "피드백을 받은 후, 이를 어떻게 받아들이고 개선해 본 경험이 있다면 말씀해주세요.",
    "correctAnswerText": "처음에는 부담스러웠지만, 피드백을 기록하고 우선순위를 정해 수정했습니다. 결과적으로 코드 품질이 향상되었고 감사의 마음을 갖게 되었습니다.",
    "requiredKeywords": ["피드백 수용", "개선 노력", "코드 품질 향상"],
    "points": 15,
    "tags": ["학습", "성장"]
  },
  {
    "id": "personality-006",
    "type": "personality",
    "format": "essay",
    "difficulty": "easy",
    "experienceLevel": "junior",
    "question": "업무 중 외부로부터 소스코드 공유 요청을 받는다면 어떻게 대응하시겠습니까?",
    "correctAnswerText": "보안과 지식재산권 보호 차원에서 회사 정책을 우선 고려하며, 관리자의 승인이 없는 외부 공유는 절대 하지 않습니다.",
    "requiredKeywords": ["보안", "정책 준수", "기밀 유지"],
    "points": 10,
    "tags": ["업무 윤리", "보안"]
  },
  {
    "id": "personality-007",
    "type": "personality",
    "format": "essay",
    "difficulty": "easy",
    "experienceLevel": "junior",
    "question": "업무 중 집중력이 흐트러질 때, 이를 극복하기 위해 어떻게 행동하시나요?",
    "correctAnswerText": "일시적으로 휴식을 취하거나 할 일을 다시 정리해 우선순위를 정합니다. Pomodoro 기법 등을 활용하여 집중력을 회복합니다.",
    "requiredKeywords": ["시간 관리", "집중", "업무 효율"],
    "points": 10,
    "tags": ["업무 윤리", "근무 태도"]
  },
  {
    "id": "personality-008",
    "type": "personality",
    "format": "essay",
    "difficulty": "medium",
    "experienceLevel": "junior",
    "question": "담당 업무를 마감 기한 내에 완료하지 못할 상황이라면 어떻게 대처하시겠습니까?",
    "correctAnswerText": "미리 팀장이나 동료에게 상황을 공유하고, 필요한 지원을 요청하거나 일정 조정을 요청합니다. 동시에 우선순위를 재조정해 최대한 빠르게 마무리합니다.",
    "requiredKeywords": ["사전 공유", "책임감", "우선순위 조정"],
    "points": 15,
    "tags": ["책임감", "신뢰성"]
  },
  {
    "id": "personality-009",
    "type": "personality",
    "format": "essay",
    "difficulty": "medium",
    "experienceLevel": "senior",
    "question": "팀 내에서 신규 입사자의 적응을 돕기 위해 어떤 방식으로 소통하고 협업하시나요?",
    "correctAnswerText": "신규 입사자가 빠르게 팀 문화에 적응할 수 있도록 멘토링을 제안하고, 업무 가이드를 제공하며 정기적으로 피드백과 질문을 받을 수 있는 분위기를 만듭니다.",
    "requiredKeywords": ["멘토링", "배려", "정기 소통"],
    "points": 15,
    "tags": ["협업", "소통"]
  },
  {
    "id": "personality-010",
    "type": "personality",
    "format": "essay",
    "difficulty": "hard",
    "experienceLevel": "senior",
    "question": "팀원 간 심각한 갈등이 발생했을 때, 리더로서 어떻게 조율하시겠습니까?",
    "correctAnswerText": "갈등의 원인을 파악하고 각자의 입장을 공정하게 경청한 후, 감정을 정리하고 객관적 사실 중심으로 해결책을 모색합니다. 장기적 신뢰 회복 방안도 고려합니다.",
    "requiredKeywords": ["공정성", "경청", "신뢰 회복"],
    "points": 20,
    "tags": ["협업", "소통"]
  },
  {
    "id": "personality-011",
    "type": "personality",
    "format": "essay",
    "difficulty": "medium",
    "experienceLevel": "senior",
    "question": "중요한 프로젝트에서 본인의 실수로 문제가 발생한 경우, 어떻게 책임지고 대응하셨나요?",
    "correctAnswerText": "문제를 은폐하지 않고 즉시 공유하였으며, 근본 원인을 분석하고 해결책을 제시했습니다. 재발 방지 방안을 정리하여 팀에 공유하였습니다.",
    "requiredKeywords": ["책임 인정", "문제 해결", "재발 방지"],
    "points": 15,
    "tags": ["책임감", "신뢰성"]
  },
  {
    "id": "personality-012",
    "type": "personality",
    "format": "essay",
    "difficulty": "hard",
    "experienceLevel": "senior",
    "question": "고객사와 약속한 기능이 기한 내 개발이 어려운 상황일 때, 어떻게 신뢰를 유지하며 대응하시겠습니까?",
    "correctAnswerText": "문제를 조기에 인지하고 고객사에 투명하게 설명합니다. 대안을 함께 논의하며 일정 조정이나 기능 우선순위 변경을 제안하고, 추후 신뢰 회복을 위한 보완책도 마련합니다.",
    "requiredKeywords": ["투명한 소통", "대안 제시", "신뢰 유지"],
    "points": 20,
    "tags": ["책임감", "신뢰성"]
  },
  {
    "id": "personality-013",
    "type": "personality",
    "format": "essay",
    "difficulty": "medium",
    "experienceLevel": "senior",
    "question": "기존 시스템에서 성능 이슈가 반복될 때, 어떻게 접근하고 문제를 해결하셨는지 말씀해주세요.",
    "correctAnswerText": "문제 발생 조건을 분석하고 로그 및 모니터링 도구를 활용해 병목 지점을 식별한 후, 코드 리팩토링이나 구조 개선을 통해 성능을 향상시켰습니다.",
    "requiredKeywords": ["분석", "도구 활용", "리팩토링"],
    "points": 15,
    "tags": ["문제 해결", "논리적 사고"]
  },
  {
    "id": "personality-014",
    "type": "personality",
    "format": "essay",
    "difficulty": "hard",
    "experienceLevel": "senior",
    "question": "팀의 방향성과 본인의 개발 철학이 다를 경우, 어떻게 접근하고 조율하셨나요?",
    "correctAnswerText": "자신의 철학을 명확히 설명하되, 팀의 목표와 일관성을 고려하여 타협 가능한 부분을 모색합니다. 필요시 중재자의 도움도 요청합니다.",
    "requiredKeywords": ["철학 설명", "타협", "팀 목표 고려"],
    "points": 20,
    "tags": ["문제 해결", "의사소통"]
  },
  {
    "id": "personality-015",
    "type": "personality",
    "format": "essay",
    "difficulty": "medium",
    "experienceLevel": "senior",
    "question": "최근 1~2년 사이에 스스로 성장했다고 느낀 계기나 프로젝트가 있다면 말씀해주세요.",
    "correctAnswerText": "고난이도 시스템 마이그레이션을 주도하면서 기술적 도전과 협업 역량을 모두 향상시켰고, 이를 통해 자신감과 책임감이 한층 높아졌습니다.",
    "requiredKeywords": ["도전", "성장 계기", "협업 경험"],
    "points": 15,
    "tags": ["학습", "성장"]
  }
]
