[
  {
    "id":"problem-solving-001",
    "type":"problem-solving",
    "format":"essay",
    "difficulty":"easy",
    "experienceLevel":"junior",
    "question":"운영 중인 쇼핑몰 웹사이트에서 일시적으로 모든 페이지가 503 오류를 반환하고 있습니다. 문제 발생 시간은 평일 오후 2시, 접속자 수는 약 200명이며 관리자 페이지는 정상 작동 중입니다. 이 상황에서 문제를 단계별로 분석하고 해결 방안을 설명해주세요.",
    "correctAnswerText":"1) 장애 인지 및 로그 분석 → 2) Web 서버 상태 확인 → 3) Application 서버와의 연결 상태 확인 → 4) DB 연결 오류 여부 확인 → 5) 원인 해결 및 모니터링 설정",
    "requiredKeywords":[
      "로그 분석",
      "서버 상태 점검",
      "장애 대응 프로세스"
    ],
    "points":10,
    "tags":[
      "시스템 장애",
      "infra"
    ]
  },
  {
    "id":"problem-solving-002",
    "type":"problem-solving",
    "format":"essay",
    "difficulty":"medium",
    "experienceLevel":"junior",
    "question":"운영 중인 고객 포털에서 로그인 시도가 일정 시간 이후 모두 실패하고 있습니다. 장애 발생 시각은 오전 9시경이며, 전체 사용자 중 30%가 로그인에 실패한 상태입니다. 어떤 방식으로 원인을 파악하고 해결할 수 있을지 설명해주세요.",
    "correctAnswerText":"1) 로그인 실패 로그 분석 → 2) 인증 모듈 상태 확인 → 3) 캐시나 세션 설정 오류 확인 → 4) 외부 인증 연동 문제 점검 → 5) 해결 후 재현 테스트 및 모니터링",
    "requiredKeywords":[
      "로그 분석",
      "세션 점검",
      "인증 모듈"
    ],
    "points":15,
    "tags":[
      "시스템 장애",
      "backend"
    ]
  },
  {
    "id":"problem-solving-003",
    "type":"problem-solving",
    "format":"essay",
    "difficulty":"medium",
    "experienceLevel":"junior",
    "question":"웹 서비스에서 갑자기 일부 페이지만 로딩 속도가 10초 이상으로 느려졌습니다. DB 쿼리는 동일하게 사용되며, 프론트엔드 코드는 최근 변경된 적이 없습니다. 이 상황에서 문제의 원인을 분석하고 해결 방안을 설명해주세요.",
    "correctAnswerText":"1) 느려진 페이지 공통 요소 확인 → 2) 외부 API 호출 유무 확인 → 3) 브라우저 콘솔과 네트워크 분석 → 4) DB slow query log 분석 → 5) 원인 수정 및 개선 방안 제시",
    "requiredKeywords":[
      "네트워크 분석",
      "공통점 도출",
      "DB 쿼리 검토"
    ],
    "points":15,
    "tags":[
      "시스템 장애",
      "fullstack"
    ]
  },
  {
    "id":"problem-solving-004",
    "type":"problem-solving",
    "format":"essay",
    "difficulty":"easy",
    "experienceLevel":"junior",
    "question":"사내 내부 시스템의 데이터 조회 속도가 갑자기 2초에서 8초로 증가했습니다. 사용자는 하루 평균 50명이며, 최근 기능 추가는 없었습니다. 이 문제의 해결 과정을 단계별로 설명해주세요.",
    "correctAnswerText":"1) DB 응답 시간 분석 → 2) 최근 인덱스 변경 확인 → 3) 특정 쿼리 성능 점검 → 4) 캐시 활용 여부 점검 → 5) 쿼리 개선 또는 인덱스 추가",
    "requiredKeywords":[
      "쿼리 분석",
      "인덱스",
      "캐시 확인"
    ],
    "points":10,
    "tags":[
      "성능 최적화",
      "database"
    ]
  },
  {
    "id":"problem-solving-005",
    "type":"problem-solving",
    "format":"essay",
    "difficulty":"medium",
    "experienceLevel":"junior",
    "question":"최근 게시판 글 목록 조회 시 페이지 렌더링 속도가 급격히 느려졌습니다. 프론트엔드 프레임워크는 React이며, 글 수는 약 1만 건입니다. 성능 문제의 원인을 분석하고 해결 절차를 설명해주세요.",
    "correctAnswerText":"1) 컴포넌트 리렌더링 여부 확인 → 2) 리스트 렌더링 방식 점검 (예: map vs. virtual scroll) → 3) 불필요한 상태 관리 제거 → 4) API 응답 속도 확인 및 페이지네이션 적용",
    "requiredKeywords":[
      "렌더링 최적화",
      "Virtual Scroll",
      "불필요한 상태 제거"
    ],
    "points":15,
    "tags":[
      "성능 최적화",
      "frontend"
    ]
  },
  {
    "id":"problem-solving-006",
    "type":"problem-solving",
    "format":"essay",
    "difficulty":"easy",
    "experienceLevel":"junior",
    "question":"고객센터에서 사용자가 모바일에서 버튼 클릭이 되지 않는다는 제보를 하였습니다. 동일 기능은 데스크탑에서는 정상 작동합니다. 이 문제를 어떻게 해결할지 설명해주세요.",
    "correctAnswerText":"1) 모바일 환경에서 브라우저 콘솔 확인 → 2) CSS z-index 또는 크기 문제 검토 → 3) 터치 이벤트 처리 확인 → 4) 문제 수정 후 QA 테스트",
    "requiredKeywords":[
      "브라우저 호환성",
      "CSS",
      "이벤트 처리"
    ],
    "points":10,
    "tags":[
      "사용자 이슈",
      "frontend"
    ]
  },
  {
    "id":"problem-solving-007",
    "type":"problem-solving",
    "format":"essay",
    "difficulty":"medium",
    "experienceLevel":"junior",
    "question":"사용자 피드백을 통해 이미지 업로드 기능에서 특정 확장자(jpg)는 업로드가 되지 않는 문제가 확인되었습니다. 오류 메시지는 없고, 다른 확장자는 정상 작동합니다. 이 상황에서 원인 분석과 해결 방안을 설명해주세요.",
    "correctAnswerText":"1) 프론트단 유효성 검증 로직 확인 → 2) 백엔드 확장자 필터 확인 → 3) MIME 타입 매핑 오류 여부 확인 → 4) 예외 처리 로그 점검 → 5) 수정 및 테스트",
    "requiredKeywords":[
      "유효성 검사",
      "확장자 필터",
      "MIME 타입"
    ],
    "points":15,
    "tags":[
      "사용자 이슈",
      "fullstack"
    ]
  },
  {
    "id":"problem-solving-008",
    "type":"problem-solving",
    "format":"essay",
    "difficulty":"medium",
    "experienceLevel":"junior",
    "question":"개발 중 코드 리뷰에서 동일한 버그가 반복적으로 발견되고 있습니다. 코드 품질을 높이기 위한 프로세스 개선 방안을 단계별로 제시해주세요.",
    "correctAnswerText":"1) 반복된 버그 패턴 분석 → 2) Lint 및 Static Analysis 도구 도입 → 3) 코드 템플릿 정의 → 4) 리뷰 체크리스트 수립 → 5) 교육 및 피드백 프로세스 개선",
    "requiredKeywords":[
      "정적 분석",
      "코드 리뷰",
      "프로세스 개선"
    ],
    "points":15,
    "tags":[
      "개발 프로세스",
      "quality"
    ]
  },
  {
    "id":"problem-solving-009",
    "type":"problem-solving",
    "format":"essay",
    "difficulty":"medium",
    "experienceLevel":"senior",
    "question":"고객 포털 사이트에서 정기적으로 발생하는 오후 3시 서버 응답 지연 이슈가 있습니다. 웹 서버와 DB 모두 정상으로 보이지만, 일부 API 호출 응답이 30초 이상 지연됩니다. 이 문제를 어떻게 구조적으로 접근하고 해결할 수 있을지 설명해주세요.",
    "correctAnswerText":"1) 시간대 기반 트래픽 분석 → 2) 문제 발생 API 호출 추적 및 로그 분석 → 3) 외부 서비스 연동 여부 검토 → 4) API 경로별 병목 구간 식별 → 5) 구조적 개선 및 부하 테스트",
    "requiredKeywords":[
      "트래픽 분석",
      "병목 파악",
      "API 추적"
    ],
    "points":20,
    "tags":[
      "시스템 장애",
      "infra"
    ]
  },
  {
    "id":"problem-solving-010",
    "type":"problem-solving",
    "format":"essay",
    "difficulty":"hard",
    "experienceLevel":"senior",
    "question":"재난 상황에서 사용되는 공공 시스템이 대규모 동시 접속(약 10만 명) 이후 무작위로 일부 사용자에게 빈 화면만 출력되는 오류가 발생하고 있습니다. 서비스는 고가용성 구조를 갖고 있으며, 클라우드 환경입니다. 이 복잡한 문제를 어떻게 해결할 수 있을지 설명해주세요.",
    "correctAnswerText":"1) 전체 아키텍처 재검토 및 장애 시나리오 정의 → 2) 요청 분산 전략과 세션 처리 방식 점검 → 3) CDN, 로드밸런서, 캐시 계층 로그 분석 → 4) 컨테이너\/인스턴스 간 자원 불균형 조사 → 5) Root Cause 식별 후 구조 개선 및 DR 시나리오 구축",
    "requiredKeywords":[
      "세션 처리",
      "로드밸런싱",
      "HA 아키텍처"
    ],
    "points":30,
    "tags":[
      "시스템 장애",
      "architecture"
    ]
  },
  {
    "id":"problem-solving-011",
    "type":"problem-solving",
    "format":"essay",
    "difficulty":"medium",
    "experienceLevel":"senior",
    "question":"최근에 도입한 실시간 대시보드 기능에서 CPU 사용률이 급격히 증가하고 있습니다. 사용자 수는 약 200명이며, 주기적 데이터 fetch가 발생합니다. 성능 병목 원인을 어떻게 분석하고 최적화할 수 있을지 설명해주세요.",
    "correctAnswerText":"1) 데이터 요청 주기 및 API 병렬성 분석 → 2) 서버 측 리소스 추적 및 프로파일링 도구 사용 → 3) 비동기 처리 방식 개선 → 4) 캐싱 전략 도입 → 5) 최소 쿼리로 구조 재설계",
    "requiredKeywords":[
      "프로파일링",
      "비동기 처리",
      "캐싱"
    ],
    "points":20,
    "tags":[
      "성능 최적화",
      "backend"
    ]
  },
  {
    "id":"problem-solving-012",
    "type":"problem-solving",
    "format":"essay",
    "difficulty":"hard",
    "experienceLevel":"senior",
    "question":"사내 배치 시스템에서 야간 대용량 처리 작업 중 메모리 누수로 인해 서버가 주기적으로 재시작되고 있습니다. 자바 기반 애플리케이션이며, GC 로그 외 추가 힌트는 없습니다. 문제 해결을 위한 분석 및 해결 절차를 단계별로 설명해주세요.",
    "correctAnswerText":"1) JVM Heap\/GC 로그 분석 → 2) 의심 객체 추적을 위한 Heap Dump 확인 → 3) 코드 내 캐시\/리스트 무한 증가 여부 확인 → 4) 메모리 프로파일링 도구 활용 → 5) GC 튜닝 및 코드 수정, 재현 테스트",
    "requiredKeywords":[
      "GC 로그",
      "Heap Dump",
      "메모리 프로파일링"
    ],
    "points":30,
    "tags":[
      "성능 최적화",
      "java"
    ]
  },
  {
    "id":"problem-solving-013",
    "type":"problem-solving",
    "format":"essay",
    "difficulty":"hard",
    "experienceLevel":"senior",
    "question":"기존 모놀리식 웹 서비스를 마이크로서비스 아키텍처로 전환하는 프로젝트를 제안받았습니다. 기술 스택은 Spring 기반이며, 팀은 6명입니다. 이 구조적 의사결정을 위한 분석과 이행 전략을 설명해주세요.",
    "correctAnswerText":"1) 서비스 경계 식별 및 분리 기준 정의 → 2) 데이터 일관성 전략 수립 → 3) 마이크로서비스 통신 방식 결정 (REST vs 메시지 기반) → 4) CI\/CD, 모니터링 체계 재정의 → 5) 단계적 전환 계획 수립",
    "requiredKeywords":[
      "서비스 분리",
      "데이터 일관성",
      "CI\/CD 전략"
    ],
    "points":30,
    "tags":[
      "기술적 의사결정",
      "architecture"
    ]
  },
  {
    "id":"problem-solving-014",
    "type":"problem-solving",
    "format":"essay",
    "difficulty":"medium",
    "experienceLevel":"senior",
    "question":"신규 배포 이후 다수의 사용자가 모바일에서 글쓰기 버튼이 사라졌다고 보고했습니다. 일부 기기에서는 정상 작동합니다. 이 문제의 원인을 어떻게 찾고, 해결하고, 커뮤니케이션할지 설명해주세요.",
    "correctAnswerText":"1) 사용자 환경(브라우저, OS) 데이터 수집 → 2) 조건부 렌더링 로직 분석 → 3) 실시간 사용자 리플레이 도구 활용 → 4) 테스트 환경 재현 및 수정 → 5) 사용자 공지 및 재배포",
    "requiredKeywords":[
      "조건부 렌더링",
      "환경 분석",
      "사용자 피드백"
    ],
    "points":20,
    "tags":[
      "사용자 이슈",
      "frontend"
    ]
  },
  {
    "id":"problem-solving-015",
    "type":"problem-solving",
    "format":"essay",
    "difficulty":"hard",
    "experienceLevel":"senior",
    "question":"다수의 팀원이 참여하는 프로젝트에서 동일 모듈을 병렬적으로 개발하는 과정에서 잦은 충돌과 의존성 문제가 발생하고 있습니다. Git 브랜칭 전략은 있지만, 병합 충돌과 빌드 실패가 빈번합니다. 이 문제를 해결할 수 있는 프로세스를 설계하고 실행 방안을 설명해주세요.",
    "correctAnswerText":"1) 현재 브랜치 전략 검토 및 문제점 도출 → 2) Feature 브랜치별 책임 명확화 → 3) PR 기반의 코드 리뷰 프로세스 강화 → 4) CI 자동 검증 및 병합 규칙 설정 → 5) 일일 통합 및 병합 시간대 고정",
    "requiredKeywords":[
      "Git 전략",
      "CI 파이프라인",
      "협업 프로세스"
    ],
    "points":30,
    "tags":[
      "개발 프로세스",
      "devops"
    ]
  }
]